title,id,type,speakers,abstract,start,end,location
Microservices Networking for Speed and Scale,CON401,Session,[],"Building microservices enables you to decouple parts of your application so you can develop and deploy code faster. But once your microservices are running, how do you ensure that they can seamlessly communicate with each other? In this session, we dive deep into microservices networking and discuss how you can build, secure, and manage the communications into, out of, and between the various microservices that make up your application. We cover key topics such as service discovery, deployments, latency, and service mesh.",2018-11-29 13:00:00,2018-11-29 14:00:00,"Mirage, Grand Ballroom F, T1"
Accelerating AWS Migrations Through Agile Transformation,DEV202-S,Session,"['Wayne Shurts', 'Jared VandeWeghe', 'Habeeb Dihu']","With an increasingly software-based value chain, Sysco Foods has been aggressively moving its infrastructure to AWS in a bid to maintain competitive position against digitally native rivals. Critical to this transition has been a holistic agile and DevOps transformation, which has accelerated cloud adoption through an IT product, platform, and service team structure specifically designed to automate and consume AWS services. In this session, we share the key lessons learned on how agile transformation can accelerate AWS migrations, and the implications of cloud enablement on IT organizations, talent, and culture. This session is brought to you by AWS partner, Deloitte Consulting LLP.",2018-11-26 14:30:00,2018-11-26 15:30:00,"Aria East, Level 1, Joshua 9, T1"
[REPEAT 1] Earn Your DevOps Black Belt: Deployment Scenarios with AWS CloudFormation,DEV308-R1,Session,"['Luis Colon', 'Chuck Meyer']","AWS CloudFormation, in combination with other tools for continuous integration and delivery pipelines, can help automate and standardize frequent deployments for many types of applications, from traditional compute and autoscaling groups to serverless applications. In this session, we will present several use cases combining CloudFormation with build and pipeline automation tools to achieve repeatable, consistent and compliant deployments without sacrificing agility.",2018-11-29 13:00:00,2018-11-29 14:00:00,"MGM, Level 1, Grand Ballroom 119, T1"
[REPEAT] CI/CD for Serverless and Containerized Applications,DEV309-R,Session,['Clare Liguori'],"To get the most out of the agility afforded by serverless and containers, it is essential to build CI/CD pipelines that help teams iterate on code and quickly release features. In this talk, we demonstrate how developers can build effective CI/CD release workflows to manage their serverless or containerized deployments on AWS. We cover infrastructure-as-code (IaC) application models, such as AWS Serverless Application Model (AWS SAM) and new imperative IaC tools. We also demonstrate how to set up CI/CD release pipelines with AWS CodePipeline and AWS CodeBuild, and we show you how to automate safer deployments with AWS CodeDeploy.",2018-11-27 19:00:00,2018-11-27 20:00:00,"Venetian, Level 4, Lando 4202, T1"
[REPEAT 1] CI/CD for Serverless and Containerized Applications,DEV309-R1,Session,['Clare Liguori'],"To get the most out of the agility afforded by serverless and containers, it is essential to build CI/CD pipelines that help teams iterate on code and quickly release features. In this talk, we demonstrate how developers can build effective CI/CD release workflows to manage their serverless or containerized deployments on AWS. We cover infrastructure-as-code (IaC) application models, such as AWS Serverless Application Model (AWS SAM) and new imperative IaC tools. We also demonstrate how to set up CI/CD release pipelines with AWS CodePipeline and AWS CodeBuild, and we show you how to automate safer deployments with AWS CodeDeploy.",2018-11-29 14:30:00,2018-11-29 15:30:00,"Bellagio, Level 1, Grand Ballroom 2, T1"
[REPEAT 4] Deploy Your Web App Safely with Blue-Green Deployments,DEV314-R4,Builders Session,[],"In this session, learn about reducing your production downtime with blue-green deployments. Learn how to quickly build your deployment pipeline using AWS CodePipeline, and take a deep dive into AWS CodeDeploy.",2018-11-29 14:30:00,2018-11-29 15:30:00,"Mirage, Grand Ballroom B, Table 3, T1"
[REPEAT] What's New with the AWS CLI,DEV322-R,Session,"['Kyle Knapp', 'James Sarywinnie']",Come hear from the core developers of the AWS Command Line Interface (AWS CLI). We show you some best practices for getting the most out of the CLI — from managing your resources to automating your workflows. We also highlight some of the recent features and major improvements we’ve made.,2018-11-26 11:30:00,2018-11-26 00:30:00,"Mirage, Grand Ballroom F, T1"
[REPEAT 1] Use Elastic Beanstalk Blue-Green Deployment to Reduce Downtime & Risk,DEV330-R1,Chalk Talk,"['Kam Mahant', 'Tim Freeman']",Blue-green deployment is a technique used to release applications by shifting traffic between two identical environments running different versions of an application. Come and learn how AWS Elastic Beanstalk makes blue-green deployments easy and helps you mitigate common risks associated with deploying software while avoiding downtime.,2018-11-28 17:30:00,2018-11-28 18:30:00,"Aria East, Level 2, Mariposa 3, T1"
[REPEAT] Microservices Insights with AWS X-Ray,DEV336-R,Builders Session,['Lucas Schejtman'],"In this session, learn how to easily debug and trace unhandled errors, performance bottlenecks, and customer impact in the distributed nature of a microservices architecture.",2018-11-26 13:00:00,2018-11-26 14:00:00,"Mirage, Grand Ballroom B, Table 4, T1"
[REPEAT 1] Microservices Insights with AWS X-Ray,DEV336-R1,Builders Session,['Lucas Schejtman'],"In this session, learn how to easily debug and trace unhandled errors, performance bottlenecks, and customer impact in the distributed nature of a microservices architecture.",2018-11-28 16:00:00,2018-11-28 17:00:00,"Aria West, Level 3, Starvine 10, Table 5, T1"
[REPEAT 2] Microservices Insights with AWS X-Ray,DEV336-R2,Builders Session,['Lucas Schejtman'],"In this session, learn how to easily debug and trace unhandled errors, performance bottlenecks, and customer impact in the distributed nature of a microservices architecture.",2018-11-30 10:00:00,2018-11-30 11:00:00,"Mirage, Grand Ballroom B, Table 1, T1"
[REPEAT] Set Up a Serverless CI/CD Pipeline with AWS CodeStar,DEV338-R,Builders Session,['Eric Beard'],"In this session, you start your first serverless application using AWS CodeStar to set up a CI/CD. Then, we debug our AWS Lambda functions using AWS Serverless Application Model (AWS SAM) Local with AWS Cloud9. Finally, we learn about monitoring distributed applications with AWS X-Ray and Amazon CloudWatch.",2018-11-26 16:00:00,2018-11-26 17:00:00,"Aria West, Level 3, Starvine 3, Table 7, T1"
[REPEAT 1] Set Up a Serverless CI/CD Pipeline with AWS CodeStar,DEV338-R1,Builders Session,['Sirirat Kongdee'],"In this session, you start your first serverless application using AWS CodeStar to set up a CI/CD. Then, we debug our AWS Lambda functions using AWS Serverless Application Model (AWS SAM) Local with AWS Cloud9. Finally, we learn about monitoring distributed applications with AWS X-Ray and Amazon CloudWatch.",2018-11-27 10:00:00,2018-11-27 11:00:00,"Mirage, Grand Ballroom D, Table 8, T1"
[REPEAT 2] Set Up a Serverless CI/CD Pipeline with AWS CodeStar,DEV338-R2,Builders Session,[],"In this session, you start your first serverless application using AWS CodeStar to set up a CI/CD. Then, we debug our AWS Lambda functions using AWS Serverless Application Model (AWS SAM) Local with AWS Cloud9. Finally, we learn about monitoring distributed applications with AWS X-Ray and Amazon CloudWatch.",2018-11-28 17:30:00,2018-11-28 18:30:00,"Aria West, Level 3, Starvine 3, Table 6, T1"
[REPEAT 3] Set Up a Serverless CI/CD Pipeline with AWS CodeStar,DEV338-R3,Builders Session,['Eric Scholz'],"In this session, you start your first serverless application using AWS CodeStar to set up a CI/CD. Then, we debug our AWS Lambda functions using AWS Serverless Application Model (AWS SAM) Local with AWS Cloud9. Finally, we learn about monitoring distributed applications with AWS X-Ray and Amazon CloudWatch.",2018-11-29 14:30:00,2018-11-29 15:30:00,"Mirage, Grand Ballroom D, Table 6, T1"
[REPEAT] Infrastructure as Code: AWS Best Practices,DEV411-R,Chalk Talk,"['Alex Wood', 'Leah Rivers']","When you consider your DevOps practice, infrastructure as code (IaC) is invaluable. IaC provides an automated way to quickly and reliably deploy the compute, storage, network, and specialized services required by your applications, and it eliminates the costly and error-prone process of manually installing and configuring infrastructure every time your application changes. In this session, learn about tools and best practices in defining your IaC. We show you how to define and deploy cloud infrastructure using modern programming languages such as TypeScript, Java, .NET, Ruby, and Python. We walk you through the process of defining your infrastructure with code and then testing and deploying it. Finally, we demonstrate how to use existing IDE functionality, such as refactoring tools, code navigation, and unit testing, to ensure it all works as expected.",2018-11-27 18:15:00,2018-11-27 19:15:00,"Aria West, Level 3, Starvine 2, T2"
[REPEAT 1] Infrastructure as Code: AWS Best Practices,DEV411-R1,Chalk Talk,"['Alex Wood', 'Leah Rivers']","When you consider your DevOps practice, infrastructure as code (IaC) is invaluable. IaC provides an automated way to quickly and reliably deploy the compute, storage, network, and specialized services required by your applications, and it eliminates the costly and error-prone process of manually installing and configuring infrastructure every time your application changes. In this session, learn about tools and best practices in defining your IaC. We show you how to define and deploy cloud infrastructure using modern programming languages such as TypeScript, Java, .NET, Ruby, and Python. We walk you through the process of defining your infrastructure with code and then testing and deploying it. Finally, we demonstrate how to use existing IDE functionality, such as refactoring tools, code navigation, and unit testing, to ensure it all works as expected.",2018-11-28 13:45:00,2018-11-28 14:45:00,"Mirage, Antigua B, T2"
[REPEAT 2] Infrastructure as Code: AWS Best Practices,DEV411-R2,Chalk Talk,"['Leah Rivers', 'Alex Wood']","When you consider your DevOps practice, infrastructure as code (IaC) is invaluable. IaC provides an automated way to quickly and reliably deploy the compute, storage, network, and specialized services required by your applications, and it eliminates the costly and error-prone process of manually installing and configuring infrastructure every time your application changes. In this session, learn about tools and best practices in defining your IaC. We show you how to define and deploy cloud infrastructure using modern programming languages such as TypeScript, Java, .NET, Ruby, and Python. We walk you through the process of defining your infrastructure with code and then testing and deploying it. Finally, we demonstrate how to use existing IDE functionality, such as refactoring tools, code navigation, and unit testing, to ensure it all works as expected.",2018-11-29 12:15:00,2018-11-29 13:15:00,"Venetian, Level 2, Veronese 2402, T2"
[REPEAT] Deploy Serverless Apps with Python: AWS Chalice Deep Dive,DEV427-R,Chalk Talk,['James Sarywinnie'],"AWS Chalice is a microframework for writing serverless applications in Python. It enables you to write and deploy serverless applications in minutes. In this session, we take a deep dive into Chalice. We take a sample Chalice application and walk through how Chalice builds and deploys it. This includes the deployment planner, automatic IAM policy generation, and how Chalice builds AWS Lambda deployment packages for Python. Come and hear from the core Chalice developers about best practices and how to get the most of the microframework. You'll be able to quickly develop and deploy serverless applications in no time.",2018-11-27 10:45:00,2018-11-27 11:45:00,"Mirage, St. Thomas B, T2"
[REPEAT 1] Deploy Serverless Apps with Python: AWS Chalice Deep Dive,DEV427-R1,Chalk Talk,['James Sarywinnie'],"AWS Chalice is a microframework for writing serverless applications in Python. It enables you to write and deploy serverless applications in minutes. In this session, we take a deep dive into Chalice. We take a sample Chalice application and walk through how Chalice builds and deploys it. This includes the deployment planner, automatic IAM policy generation, and how Chalice builds AWS Lambda deployment packages for Python. Come and hear from the core Chalice developers about best practices and how to get the most of the microframework. You'll be able to quickly develop and deploy serverless applications in no time.",2018-11-28 14:30:00,2018-11-28 15:30:00,"Aria East, Level 2, Mariposa 3, T1"
[REPEAT 1] Well Operated: A Day in the Life of a Cloud Ops Engineer,ENT312-R1,Session,"['Orion Bijleveld', 'Wallace Simpson']","Are you an expert data center operations engineer looking to sharpen your AWS skills? Are you an IT operations manager looking to speed up your team's cloud learning curve for operating in a hybrid cloud environment? Are you a DevOps engineer looking to grow your operations experience? This session follows two AWS operations experts throughout their day as they solve real-life problems in complex, enterprise hybrid cloud AWS environments. Expect to learn actionable hacks and tricks that you won't get in standard training classes, practical advice for solving common and not-so-common issues, and insights in to the top things our experts wish they knew when they were getting started with AWS.
",2018-11-30 08:30:00,2018-11-30 09:30:00,"Venetian, Level 4, Lando 4202, T1"
[REPEAT 1] What's New with AWS CloudFormation,DEV321-R1,Session,"['Anil Kumar', 'Manu Suresh', 'Luis Colon']","AWS CloudFormation is one of the most widely used tools in the AWS ecosystem, enabling infrastructure as code, deployment automation, repeatability, compliance and standardization. In this session, we cover the latest improvements and best practices for AWS CloudFormation customers in particular, and for seasoned infrastructure engineers in general. We cover new features and improvements that span many use cases, including programmability options, cross region and cross account automation, operational safety, and additional integration with many other AWS services.",2018-11-30 09:15:00,2018-11-30 10:15:00,"Venetian, Level 2, Venetian F, T2"
How Fox Sports Delivered the 2018 FIFA World Cup from Russia with AWS,ARC333,Session,"['Bhavik Vyas', 'Mike Flathers', 'Adam Hall']","The 2018 FIFA World Cup was the biggest production in Fox Sports 20-year history in terms of personnel, hours, and scale. It broadcast 64 matches, more than four previous World Cups combined. To deliver this, they deployed a revolutionary joint solution from AWS, Aspera, and Telestream, which enabled live delivery of broadcast video from Russia to Los Angeles for remote production. In this session, learn the architectural patterns of large-scale data and content movement to the cloud over long distances with low latency requirements, the HA requirements around broadcast workloads, and trade-offs to consider. We cover how Amazon S3, Amazon EC2, AWS Lambda, Amazon SQS, and other services processed over 1.9 PB of original content over the 30 day tournament.",2018-11-26 14:30:00,2018-11-26 15:30:00,"Aria East, Level 2, Mariposa 5, T1"
Scaling Push Messaging for Millions of Netflix Devices,ARC334,Session,['Susheel Aroskar'],"Netflix built Zuul Push, a massively scalable push messaging service that handles millions of always-on, persistent connections to proactively push time-sensitive data, like personalized movie recommendations, from the AWS Cloud to devices. This has helped reduce Netflix’s notification latency and Amazon EC2 footprint by eliminating wasteful polling requests. It also powers Netflix’s integration with Amazon Alexa. Zuul push is a high performance async WebSocket/SSE server. In this session, we cover its design and how it delivers push notifications globally across AWS Regions.  Key takeaways include how to scale to large number of persistent connections, differences between operating this type of service versus traditional request/response style stateless services, and how push messaging can be used to add new, exciting features to your application.",2018-11-26 10:45:00,2018-11-26 11:45:00,"Venetian, Level 5, Palazzo O, T2"
Next-Generation e-Commerce Architectures,RET207,Session,"['Bastien Leblanc', 'Toby Knight', 'Charles Wilkinson']","In this session, we review the most modern e-commerce architectures, patterns, and technologies that are being used by digital innovators. We examine micro-services as well as event-driven and event-sourced architectures. We provide examples of how these patterns are implemented on AWS, and we review the benefits of each one. Learn how to select a pattern for your workload and which combination of AWS services can be used to build them. We use real-world customer examples so you can see the practical applications of these patterns.",2018-11-26 16:00:00,2018-11-26 17:00:00,"Aria East, Level 1, Joshua 9, T1"
